{
  "layout_id": "scene_012121",
  "program_order": [
    "bedroom_01",
    "children_s_bedroom_01",
    "kitchen_01",
    "living_room_01",
    "master_bedroom_01"
  ],
  "programs": [
    {
      "program_id": "bedroom_01",
      "room_type": "bedroom"
    },
    {
      "program_id": "children_s_bedroom_01",
      "room_type": "children's bedroom"
    },
    {
      "program_id": "kitchen_01",
      "room_type": "kitchen"
    },
    {
      "program_id": "living_room_01",
      "room_type": "living room"
    },
    {
      "program_id": "master_bedroom_01",
      "room_type": "master bedroom"
    }
  ],
  "schema_version": "non_rectangular_room_program_v1",
  "target_total_instances": {
    "max": 106,
    "min": 85
  }
}
