{
  "layout_id": "scene_011888",
  "program_order": [
    "bathroom_01",
    "living_room_01",
    "master_bedroom_01"
  ],
  "programs": [
    {
      "program_id": "bathroom_01",
      "room_type": "bathroom"
    },
    {
      "program_id": "living_room_01",
      "room_type": "living room"
    },
    {
      "program_id": "master_bedroom_01",
      "room_type": "master bedroom"
    }
  ],
  "schema_version": "non_rectangular_room_program_v1",
  "target_total_instances": {
    "max": 60,
    "min": 48
  }
}
