{
  "layout_id": "scene_011972",
  "program_order": [
    "bathroom_01",
    "bedroom_01",
    "home_office_01",
    "living_room_with_dining_area_01",
    "master_bedroom_01"
  ],
  "programs": [
    {
      "program_id": "bathroom_01",
      "room_type": "bathroom"
    },
    {
      "program_id": "bedroom_01",
      "room_type": "bedroom"
    },
    {
      "program_id": "home_office_01",
      "room_type": "home office"
    },
    {
      "program_id": "living_room_with_dining_area_01",
      "room_type": "living room with dining area"
    },
    {
      "program_id": "master_bedroom_01",
      "room_type": "master bedroom"
    }
  ],
  "schema_version": "non_rectangular_room_program_v1",
  "target_total_instances": {
    "max": 40,
    "min": 32
  }
}
