{
  "layout_id": "scene_011760",
  "program_order": [
    "bedroom_01",
    "home_office_01",
    "living_room_01"
  ],
  "programs": [
    {
      "program_id": "bedroom_01",
      "room_type": "bedroom"
    },
    {
      "program_id": "home_office_01",
      "room_type": "home office"
    },
    {
      "program_id": "living_room_01",
      "room_type": "living room"
    }
  ],
  "schema_version": "non_rectangular_room_program_v1",
  "target_total_instances": {
    "max": 49,
    "min": 40
  }
}
