{
  "layout_id": "scene_011923",
  "program_order": [
    "children_s_bedroom_01",
    "kitchen_01",
    "living_room_with_dining_area_01",
    "master_bedroom_01",
    "master_bedroom_02"
  ],
  "programs": [
    {
      "program_id": "children_s_bedroom_01",
      "room_type": "children's bedroom"
    },
    {
      "program_id": "kitchen_01",
      "room_type": "kitchen"
    },
    {
      "program_id": "living_room_with_dining_area_01",
      "room_type": "living room with dining area"
    },
    {
      "program_id": "master_bedroom_01",
      "room_type": "master bedroom"
    },
    {
      "program_id": "master_bedroom_02",
      "room_type": "master bedroom"
    }
  ],
  "schema_version": "non_rectangular_room_program_v1",
  "target_total_instances": {
    "max": 133,
    "min": 107
  }
}
